,amazon_isbn,author,binding,img,isbn,page_count,percent_off,price,rating,rating_count,title_x,url,price_index,rating_index,rating_count_index,k_score_alt,k_score,title_y,description,desc_short,new_score0,691158282,Michael Suk-Young Chwe,Paperback,https://images-na.ssl-images-amazon.com/images/I/51b5N-ijqZL.jpg,9.78069E+12,152,,2495,3.31,218,"Rational Ritual: Culture, Coordination, and Common Knowledge",https://www.amazon.com/Rational-Ritual-Culture-Coordination-Knowledge/dp/0691158282?SubscriptionId=AKIAJZAKURNIAY4STOJQ&tag=karslucon-20&linkCode=xm2&camp=2025&creative=165953&creativeASIN=0691158282,0,0,0.032971663,0.004121458,0.010990554,Rational Ritual,"Why do Internet, financial service, and beer commercials dominate Super Bowl advertising? How do political ceremonies establish authority? Why does repetition characterize anthems and ritual speech? Why were circular forms favored for public festivals during the French Revolution? This book answers these questions using a single concept: common knowledge. Game theory shows that in order to coordinate its actions, a group of people must form ""common knowledge."" Each person wants to participate only if others also participate. Members must have knowledge of each other, knowledge of that knowledge, knowledge of the knowledge of that knowledge, and so on. Michael Chwe applies this insight, with striking erudition, to analyze a range of rituals across history and cultures. He shows that public ceremonies are powerful not simply because they transmit meaning from a central source to each audience member but because they let audience members know what other members know.","ritual speech, circular forms, public festivals, revolution, transmit meaning",15.751,465065694,Moises Naim,Paperback,https://images-na.ssl-images-amazon.com/images/I/41WWSSV6ZiL.jpg,9.78047E+12,320,31,1173,3.61,2631,"The End of Power: From Boardrooms to Battlefields and Churches to States, Why Being In Charge Isn't What It Used to Be",https://www.amazon.com/End-Power-Boardrooms-Battlefields-Churches/dp/0465065694?SubscriptionId=AKIAJZAKURNIAY4STOJQ&tag=karslucon-20&linkCode=xm2&camp=2025&creative=165953&creativeASIN=0465065694,79.30413917,25,1.506316516,3.313289564,35.2701519,The End of Power,"We know that power is shifting: From West to East and North to South, from presidential palaces to public squares, from once formidable corporate behemoths to nimble startups and, slowly but surely, from men to women. But power is not merely shifting and dispersing. It is also decaying. Those in power today are more constrained in what they can do with it and more at risk of losing it than ever before. In The End of Power, award-winning columnist and former Foreign Policy editor Moises Naim illuminates the struggle between once-dominant megaplayers and the new micropowers challenging them in every field of human endeavor. Drawing on provocative, original research, Naim shows how the antiestablishment drive of micropowers can topple tyrants, dislodge monopolies, and open remarkable new opportunities, but it can also lead to chaos and paralysis.","presidential palaces, public squares, formidible corporate behemoths, nimble startups, power",123.162,1455504203,Henry M. Paulson,Paperback,https://images-na.ssl-images-amazon.com/images/I/518M2ZLdn5L.jpg,9.78146E+12,448,32,1223,3.73,945,Dealing with China: An Insider Unmasks the New Economic Superpower,https://www.amazon.com/Dealing-China-Insider-Economic-Superpower/dp/1455504203?SubscriptionId=AKIAJZAKURNIAY4STOJQ&tag=karslucon-20&linkCode=xm2&camp=2025&creative=165953&creativeASIN=1455504203,76.30473905,35,0.476867936,4.434608492,37.26053566,Dealing With China,"Hank Paulson has dealt with China unlike any other foreigner. As head of Goldman Sachs, Paulson had a pivotal role in opening up China to private enterprise. Then, as Treasury secretary, he created the Strategic Economic Dialogue with what is now the world's second-largest economy. While negotiating with China on economic reforms, he safeguarded the teetering U.S. financial system. Paulson has worked with scores of top Chinese leaders, including Xi Jinping, China's most powerful man in decades. Now, in DEALING WITH CHINA, he takes readers behind closed doors to witness the future of China's state-controlled capitalism.","Hank Paulson, China, pivotal role, dialogue",100.353,1786071339,Vaclav Smil,Paperback,https://images-na.ssl-images-amazon.com/images/I/51CyM98RFYL.jpg,9.78179E+12,240,32,1019,3.88,418,Energy: A Beginner's Guide (Beginner's Guides),https://www.amazon.com/Energy-Beginners-Guide-Guides/dp/1786071339?SubscriptionId=AKIAJZAKURNIAY4STOJQ&tag=karslucon-20&linkCode=xm2&camp=2025&creative=165953&creativeASIN=1786071339,88.54229154,47.5,0.155088932,5.956886116,45.39912682,Energy: A Beginner's Guide,"As Einstein pointed out in his famous equation, E=MC2, all matter can be described as energy. It is everywhere; it is everything. In this engaging book, prolific author and academic Vaclav Smil provides an introduction to the far-reaching term and gives the reader a greater understanding of energy's place in both past and present society. Starting with an explanation of the concept, he goes on to cover such exciting topics as the inner workings of the human body, and the race for more efficient and environmentally friendly fuels. With global warming becoming a mainstream political issue, this guide will help shed light on the science behind it and efforts to prevent it, and how our seemingly insignificant daily decisions affect energy consumption. Whether you're after insight or dinner table conversation, ""Energy: A Beginner's Guide"" will amaze and inform, uncovering the science behind one of the most important concepts in our universe.","Einstein, famous equation, energy, beginner, important concepts",118.054,1555977200,Eula Biss,Paperback,https://images-na.ssl-images-amazon.com/images/I/418YDdkorRL.jpg,9.78156E+12,224,15,1360,3.87,7061,On Immunity: An Inoculation,https://www.amazon.com/Immunity-Inoculation-Eula-Biss/dp/1555977200?SubscriptionId=AKIAJZAKURNIAY4STOJQ&tag=karslucon-20&linkCode=xm2&camp=2025&creative=165953&creativeASIN=1555977200,68.08638272,46.66666667,4.211214029,6.359735087,39.65475447,On Immunity: An Inoculation,"Upon becoming a new mother, Eula Biss addresses a chronic condition of fear--fear of the government, the medical establishment, and what is in your child's air, food, mattress, medicine, and vaccines. She finds that you cannot immunize your child, or yourself, from the world.","medical establishment, new mother, chronic condition, America",171.115,9.78069E+12,Daryl Collins,Paperback,https://images-na.ssl-images-amazon.com/images/I/41yNUGllLzL.jpg,9.78069E+12,296,49,1482,3.93,843,Portfolios of the Poor: How the World's Poor Live on $2 a Day,https://www.amazon.com/Portfolios-Poor-How-Worlds-Live/dp/0691148198?SubscriptionId=AKIAJZAKURNIAY4STOJQ&tag=karslucon-20&linkCode=xm2&camp=2025&creative=165953&creativeASIN=0691148198,60.76784643,51.66666667,0.414588129,6.510156849,37.61636708,Portfolios of the Poor,"Nearly forty percent of humanity lives on an average of two dollars a day or less. If you've never had to survive on an income so small, it is hard to imagine. How would you put food on the table, afford a home, and educate your children? How would you handle emergencies and old age? Every day, more than a billion people around the world must answer these questions. Portfolios of the Poor is the first book to systematically explain how the poor find solutions to their everyday financial problems.","old age, portfolios, everyday financial problems",97.46,61452068,Matt Ridley,Paperback,https://images-na.ssl-images-amazon.com/images/I/41TfA2m3u6L.jpg,9.78006E+12,480,31,1098,3.98,6838,The Rational Optimist: How Prosperity Evolves (P.s.),https://www.amazon.com/Rational-Optimist-Prosperity-Evolves-P-s/dp/0061452068?SubscriptionId=AKIAJZAKURNIAY4STOJQ&tag=karslucon-20&linkCode=xm2&camp=2025&creative=165953&creativeASIN=0061452068,83.80323935,55.83333333,4.075053274,7.488548326,47.90387532,The Rational Optimist,"Life is getting better - and at an accelerating rate. Food availability, income, and life span are up; disease, child mortality, and violence are down - all across the globe. Though the world is far from perfect, necessities and luxuries alike are getting cheaper; population growth is slowing; Africa is following Asia out of poverty; the Internet, the mobile phone, and container shipping are enriching people's lives as never before. The pessimists who dominate public discourse insist that we will soon reach a turning point and things will start to get worse. But they have been saying this for two hundred years. Yet Matt Ridley does more than describe how things are getting better. He explains why. Prosperity comes from everybody working for everybody else. The habit of exchange and specialization - which started more than 100,000 years ago - has created a collective brain that sets human living standards on a rising trend. The mutual dependence, trust, and sharing that result are causes for hope, not despair.","life span, child mortality, population growth, turning point",187.487,143127713,Henry Kissinger,Paperback,https://images-na.ssl-images-amazon.com/images/I/41gbrDDTFLL.jpg,9.78014E+12,432,36,1223,4.06,5727,World Order,https://www.amazon.com/World-Order-Henry-Kissinger/dp/0143127713?SubscriptionId=AKIAJZAKURNIAY4STOJQ&tag=karslucon-20&linkCode=xm2&camp=2025&creative=165953&creativeASIN=0143127713,76.30473905,62.5,3.396691843,8.23708648,47.40047697,World Order,"Henry Kissinger offers in World Order a deep meditation on the roots of international harmony and global disorder. Drawing on his experience as one of the foremost statesmen of the modern era-advising presidents, traveling the world, observing and shaping the central foreign policy events of recent decades - Kissinger now reveals his analysis of the ultimate challenge for the twenty-first century: how to build a shared international order in a world of divergent historical perspectives, violent conflict, proliferating technology, and ideological extremism.","Henry Kissinger, world order, recent decades, historical perspectives",174.128,140390340,William James,Paperback,https://images-na.ssl-images-amazon.com/images/I/51UYJthAf8L.jpg,9.78014E+12,576,19,1384,4.04,8757,The Varieties of Religious Experience: A Study in Human Nature (Penguin American Library),https://www.amazon.com/Varieties-Religious-Experience-Penguin-American/dp/0140390340?SubscriptionId=AKIAJZAKURNIAY4STOJQ&tag=karslucon-20&linkCode=xm2&camp=2025&creative=165953&creativeASIN=0140390340,66.64667067,60.83333333,5.246768472,8.260012726,44.24225749,The Varieties of Religious Experience,"When William James went to the University of Edinburgh in 1901 to deliver a series of lectures on ""natural religion,"" he defined religion as ""the feelings, acts, and experiences of individual men in their solitude, so far as they apprehend themselves to stand in relation to whatever they may consider the divine."" Considering religion, then, not as it is defined by--or takes place in--the churches, but as it is felt in everyday life, he undertook a project that, upon completion, stands not only as one of the most important texts on psychology ever written, not only as a vitally serious contemplation of spirituality, but for many critics one of the best works of nonfiction written in the 20th century.","",195.379,9.78014E+12,David Deutsch,Paperback,https://images-na.ssl-images-amazon.com/images/I/51H9D%2Bp2RSL.jpg,9.78014E+12,496,8,1841,4.1,3728,The Beginning of Infinity: Explanations That Transform the World,https://www.amazon.com/Beginning-Infinity-Explanations-Transform-World/dp/0143121359?SubscriptionId=AKIAJZAKURNIAY4STOJQ&tag=karslucon-20&linkCode=xm2&camp=2025&creative=165953&creativeASIN=0143121359,39.23215357,65.83333333,2.176129737,8.501182884,35.74720555,The Beginning of Infinity,"In this groundbreaking book, award-winning physicist David Deutsch argues that explanations have a fundamental place in the universe - and that improving them is the basic regulating principle of all successful human endeavor. Taking us on a journey through every fundamental field of science, as well as the history of civilization, art, moral values, and the theory of political institutions, Deutsch tracks how we form new explanations and drop bad ones, explaining the conditions under which progress - which he argues is potentially boundless - can and cannot happen. Hugely ambitious and highly original, The Beginning of Infinityexplores and establishes deep connections between the laws of nature, the human condition, knowledge, and the possibility for progress.","",125.2310,014311493X,Sudhir Venkatesh,Paperback,https://images-na.ssl-images-amazon.com/images/I/51xB5vVSQSL.jpg,9.78014E+12,320,14,1546,4.02,18722,Gang Leader for a Day: A Rogue Sociologist Takes to the Streets,https://www.amazon.com/Gang-Leader-Day-Sociologist-Streets/dp/014311493X?SubscriptionId=AKIAJZAKURNIAY4STOJQ&tag=karslucon-20&linkCode=xm2&camp=2025&creative=165953&creativeASIN=014311493X,56.92861428,59.16666667,11.33126141,8.81224101,42.47551412,Gang Leader for a Day,"The story of the young sociologist who studied a Chicago crack-dealing gang from the inside captured the world's attention when it was first described in ""Freakonomics."" ""Gang Leader for a Day"" is the fascinating full story of how Sudhir Venkatesh managed to gain entrance into the gang, what he learned, and how his method revolutionized the academic establishment.","",198.711,9.78031E+12,Daron Acemoglu,Paperback,https://images-na.ssl-images-amazon.com/images/I/51E6WiDFSHL.jpg,9.78031E+12,544,10,1710,4.03,18979,"Why Nations Fail: The Origins of Power, Prosperity, and Poverty",https://www.amazon.com/Why-Nations-Fail-Origins-Prosperity/dp/0307719227?SubscriptionId=AKIAJZAKURNIAY4STOJQ&tag=karslucon-20&linkCode=xm2&camp=2025&creative=165953&creativeASIN=0307719227,47.09058188,60,11.4881821,8.936022763,39.52625466,Why Nations Fail,"Brilliant and engagingly written, Why Nations Fail answers the question that has stumped the experts for centuries: Why are some nations rich and others poor, divided by wealth and poverty, health and sickness, food and famine?","",19112,9.78014E+12,Jon Gertner,Paperback,https://images-na.ssl-images-amazon.com/images/I/51LyIMnRk9L.jpg,9.78014E+12,432,12,1575,4.14,4303,The Idea Factory: Bell Labs and the Great Age of American Innovation,https://www.amazon.com/Idea-Factory-Great-American-Innovation/dp/0143122797?SubscriptionId=AKIAJZAKURNIAY4STOJQ&tag=karslucon-20&linkCode=xm2&camp=2025&creative=165953&creativeASIN=0143122797,55.18896221,69.16666667,2.527216886,8.961735444,42.29428192,The Idea Factory,"The definitive history of America's greatest incubator of innovation, the birthplace of some of the 20th century's most influential technologies, including the integrated circuit, the communications satellite and the cell phone.","",146.2813,60894083,Matt Ridley,Paperback,https://images-na.ssl-images-amazon.com/images/I/51FjqA33BiL.jpg,9.78006E+12,368,10,1522,4.03,21104,Genome: The Autobiography of a Species in 23 Chapters,https://www.amazon.com/Genome-Autobiography-Species-23-Chapters/dp/0060894083?SubscriptionId=AKIAJZAKURNIAY4STOJQ&tag=karslucon-20&linkCode=xm2&camp=2025&creative=165953&creativeASIN=0060894083,58.36832633,60,12.78567809,9.098209761,43.71800147,Genome,"Arguably the most significant scientific discovery of the new century, the mapping of the twenty-three pairs of chromosomes that make up the human genome raises almost as many questions as it answers. Questions that will profoundly impact the way we think about disease, about longevity, and about free will. Questions that will affect the rest of your life. Genome offers extraordinary insight into the ramifications of this incredible breakthrough. By picking one newly discovered gene from each pair of chromosomes and telling its story, Matt Ridley recounts the history of our species and its ancestors from the dawn of life to the brink of future medicine. From Huntington's disease to cancer, from the applications of gene therapy to the horrors of eugenics, Matt Ridley probes the scientific, philosophical, and moral issues arising as a result of the mapping of the genome. It will help you understand what this scientific milestone means for you, for your children, and for humankind.","",200.414,691166285,Ibn Ibn Khaldun,Paperback,https://images-na.ssl-images-amazon.com/images/I/41-XIUYia8L.jpg,9.78069E+12,512,31,1715,4.3,3032,The Muqaddimah: An Introduction to History - Abridged Edition (Princeton Classics),https://www.amazon.com/Muqaddimah-Introduction-Abridged-Princeton-Classics/dp/0691166285?SubscriptionId=AKIAJZAKURNIAY4STOJQ&tag=karslucon-20&linkCode=xm2&camp=2025&creative=165953&creativeASIN=0691166285,46.79064187,82.5,1.751161641,10.53139521,43.68060117,The Muqaddimah,"The Muqaddimah, often translated as ""Introduction"" or ""Prolegomenon,"" is the most important Islamic history of the premodern world. Written by the great fourteenth-century Arab scholar Ibn Khaldun (d. 1406), this monumental work established the foundations of several fields of knowledge, including the philosophy of history, sociology, ethnography, and economics. The first complete English translation, by the eminent Islamicist and interpreter of Arabic literature Franz Rosenthal, was published in three volumes in 1958 as part of the Bollingen Series and received immediate acclaim in the United States and abroad. A one-volume abridged version of Rosenthal's masterful translation first appeared in 1969.","",134.5715,143122010,Steven Pinker,Paperback,https://images-na.ssl-images-amazon.com/images/I/516CVc6b5BL.jpg,9.78014E+12,832,38,1237,4.2,17060,The Better Angels of Our Nature: Why Violence Has Declined,https://www.amazon.com/Better-Angels-Our-Nature-Violence/dp/0143122010?SubscriptionId=AKIAJZAKURNIAY4STOJQ&tag=karslucon-20&linkCode=xm2&camp=2025&creative=165953&creativeASIN=0143122010,75.46490702,74.16666667,10.3164669,10.5603917,53.31601353,The Better Angels of Our Nature,"Believe it or not, today we may be living in the most peaceful moment in our species' existence. In his gripping and controversial new work, New York Times bestselling author Steven Pinker shows that despite the ceaseless news about war, crime, and terrorism, violence has actually been in decline over long stretches of history. Exploding myths about humankind's inherent violence and the curse of modernity, this ambitious book continues Pinker's exploration of the essence of human nature, mixing psychology and history to provide a remarkable picture of an increasingly enlightened world.","",223.1516,812993012,Ed Catmull,Hardcover,https://images-na.ssl-images-amazon.com/images/I/41xzn-l9yPL.jpg,9.78081E+12,368,42,1619,4.2,41840,"Creativity, Inc.: Overcoming the Unseen Forces That Stand in the Way of True Inspiration",https://www.amazon.com/Creativity-Inc-Overcoming-Unseen-Inspiration/dp/0812993012?SubscriptionId=AKIAJZAKURNIAY4STOJQ&tag=karslucon-20&linkCode=xm2&camp=2025&creative=165953&creativeASIN=0812993012,52.5494901,74.16666667,25.44679656,12.4516829,50.72098444,"Creativity, Inc.","From Ed Catmull, co-founder (with Steve Jobs and John Lasseter) of Pixar Animation Studios, comes an incisive book about creativity in business-sure to appeal to readers of Daniel Pink, Tom Peters, and Chip and Dan Heath. Creativity, Inc. is a book for managers who want to lead their employees to new heights, a manual for anyone who strives for originality, and the first-ever, all-access trip into the nerve center of Pixar Animation-into the meetings, postmortems, and ""Braintrust"" sessions where some of the most successful films in history are made. It is, at heart, a book about how to build a creative culture-but it is also, as Pixar co-founder and president Ed Catmull writes, ""an expression of the ideas that I believe make the best in us possible."" For nearly twenty years, Pixar has dominated the world of animation, producing such beloved films as the Toy Story trilogy, Monsters, Inc., Finding Nemo, The Incredibles, Up, and WALL-E, which have gone on to set box-office records and garner thirty Academy Awards. The joyousness of the storytelling, the inventive plots, the emotional authenticity: In some ways, Pixar movies are an object lesson in what creativity really is. Here, in this book, Catmull reveals the ideals and techniques that have made Pixar so widely admired-and so profitable.","",204.0517,1501127705,Peter Huber,Paperback,https://images-na.ssl-images-amazon.com/images/I/51g7NA3v26L.jpg,9.7815E+12,384,41,937,3.39,164,Orwell's Revenge: The 1984 Palimpsest,https://www.amazon.com/Orwells-Revenge-Palimpsest-Peter-Huber/dp/1501127705?SubscriptionId=AKIAJZAKURNIAY4STOJQ&tag=karslucon-20&linkCode=xm2&camp=2025&creative=165953&creativeASIN=1501127705,93.46130774,6.666666667,0,50.83333333,33.37599147,Orwell's Revenge,"George Orwell's bleak vision of the future, one in which citizens are monitored through telescreens by an insidious Big Brother, has haunted our imagination long after the publication of 1984. Orwell's dystopian image of the telescreen as a repressive instrument of state power has profoundly affected our view of technology, posing a stark confrontational question: Who will be master, human or machine? Experience has shown, however, that Orwell's vision of the future was profoundly and significantly wrong: The conjunction of the new communications technologies has not produced a master-slave relation between person and computer, but rather exciting possibilities for partnership. Peter Huber reveres Orwell's legacy, but understands his error, seeing this new technological revolution for what it is: a force not for political repression, but for freedom and enhanced creativity.","",97.6518,316005401,Iain M. Banks,Paperback,https://images-na.ssl-images-amazon.com/images/I/51qES5r-5cL.jpg,9.78032E+12,416,5,1513,4.26,49516,The Player of Games (Culture),https://www.amazon.com/Player-Games-Culture-Iain-Banks/dp/0316005401?SubscriptionId=AKIAJZAKURNIAY4STOJQ&tag=karslucon-20&linkCode=xm2&camp=2025&creative=165953&creativeASIN=0316005401,58.90821836,79.16666667,30.13365735,13.6625405,56.06951412,The Player of Games,"The Culture - a human/machine symbiotic society - has thrown up many great Game Players, and one of the greatest is Gurgeh. Jernau Morat Gurgeh. The Player of Games. Master of every board, computer and strategy. Bored with success, Gurgeh travels to the Empire of Azad, cruel and incredibly wealthy, to try their fabulous game...a game so complex, so like life itself, that the winner becomes emperor. Mocked, blackmailed, almost murdered, Gurgeh accepts the game, and with it the challenge of his life - and very possibly his death.","",212.3519,1595586431,Michelle Alexander,Paperback,https://images-na.ssl-images-amazon.com/images/I/510%2BVWiyU7L.jpg,9.7816E+12,336,32,1356,4.51,35997,The New Jim Crow:  Mass Incarceration in the Age of Colorblindness,https://www.amazon.com/New-Jim-Crow-Incarceration-Colorblindness/dp/1595586431?SubscriptionId=AKIAJZAKURNIAY4STOJQ&tag=karslucon-20&linkCode=xm2&camp=2025&creative=165953&creativeASIN=1595586431,68.32633473,100,21.87914054,15.23489257,63.40182509,The New Jim Crow,"As the United States celebrates the nation's ""triumph over race"" with the election of Barack Obama, the majority of young black men in major American cities are locked behind bars or have been labeled felons for life. Although Jim Crow laws have been wiped off the books, an astounding percentage of the African American community remains trapped in a subordinate status--much like their grandparents before them. In this incisive critique, former litigator-turned-legal-scholar Michelle Alexander provocatively argues that we have not ended racial caste in America: we have simply redesigned it. Alexander shows that, by targeting black men and decimating communities of color, the U.S. criminal justice system functions as a contemporary system of racial control, even as it formally adheres to the principle of color blindness. The New Jim Crow challenges the civil rights community--and all of us--to place mass incarceration at the forefront of a new movement for racial justice in America.","",232.7